{
  "chief_complaint": "fatigue",
  "vitals": {
    "bp": "113/78",
    "hr": 88,
    "temp_f": 98.4,
    "spo2": 98
  },
  "medications": [
    {
      "name": "albuterol",
      "dose": "2 puffs",
      "frequency": "q4h prn",
      "route": "inhaled"
    }
  ],
  "diagnoses": [
    {
      "description": "type 2 diabetes",
      "icd10": "E11.9"
    }
  ],
  "plan": [
    "rest",
    "hydration",
    "return precautions"
  ],
  "follow_up": {
    "interval_days": 24,
    "reason": "symptom review"
  }
}