{
  "chief_complaint": "headache",
  "vitals": {
    "bp": "118/83",
    "hr": 68,
    "temp_f": 98.0,
    "spo2": 98
  },
  "medications": [
    {
      "name": "ibuprofen",
      "dose": "200mg",
      "frequency": "BID",
      "route": "oral"
    }
  ],
  "diagnoses": [
    {
      "description": "type 2 diabetes",
      "icd10": "E11.9"
    }
  ],
  "plan": [
    "rest",
    "hydration",
    "return precautions"
  ],
  "follow_up": {
    "interval_days": 29,
    "reason": "symptom review"
  }
}