{
  "chief_complaint": "nausea",
  "vitals": {
    "bp": "123/83",
    "hr": 78,
    "temp_f": 99.2,
    "spo2": 98
  },
  "medications": [
    {
      "name": "lisinopril",
      "dose": "10mg",
      "frequency": "daily",
      "route": "oral"
    }
  ],
  "diagnoses": [
    {
      "description": "type 2 diabetes",
      "icd10": "E11.9"
    }
  ],
  "plan": [
    "rest",
    "hydration",
    "return precautions"
  ],
  "follow_up": {
    "interval_days": 14,
    "reason": "symptom review"
  }
}