{
  "chief_complaint": "back pain",
  "vitals": {
    "bp": "122/82",
    "hr": 77,
    "temp_f": 99.0,
    "spo2": 97
  },
  "medications": [
    {
      "name": "ibuprofen",
      "dose": "200mg",
      "frequency": "BID",
      "route": "oral"
    }
  ],
  "diagnoses": [
    {
      "description": "viral URI",
      "icd10": "J06.9"
    }
  ],
  "plan": [
    "rest",
    "hydration",
    "return precautions"
  ],
  "follow_up": {
    "interval_days": 13,
    "reason": "symptom review"
  }
}