{
  "chief_complaint": "fatigue",
  "vitals": {
    "bp": "112/72",
    "hr": 67,
    "temp_f": 98.4,
    "spo2": 97
  },
  "medications": [
    {
      "name": "metformin",
      "dose": "500mg",
      "frequency": "BID",
      "route": "oral"
    }
  ],
  "diagnoses": [
    {
      "description": "viral URI",
      "icd10": "J06.9"
    }
  ],
  "plan": [
    "rest",
    "hydration",
    "return precautions"
  ],
  "follow_up": {
    "interval_days": 3,
    "reason": "symptom review"
  }
}