{
  "chief_complaint": "fatigue",
  "vitals": {
    "bp": "119/79",
    "hr": 74,
    "temp_f": 98.4,
    "spo2": 99
  },
  "medications": [
    {
      "name": "lisinopril",
      "dose": "10mg",
      "frequency": "daily",
      "route": "oral"
    }
  ],
  "diagnoses": [
    {
      "description": "low back strain",
      "icd10": "S39.012A"
    }
  ],
  "plan": [
    "rest",
    "hydration",
    "return precautions"
  ],
  "follow_up": {
    "interval_days": 10,
    "reason": "symptom review"
  }
}