{
  "chief_complaint": "dizziness",
  "vitals": {
    "bp": "128/73",
    "hr": 83,
    "temp_f": 98.8,
    "spo2": 98
  },
  "medications": [
    {
      "name": "metformin",
      "dose": "500mg",
      "frequency": "BID",
      "route": "oral"
    }
  ],
  "diagnoses": [
    {
      "description": "type 2 diabetes",
      "icd10": "E11.9"
    }
  ],
  "plan": [
    "rest",
    "hydration",
    "return precautions"
  ],
  "follow_up": {
    "interval_days": 19,
    "reason": "symptom review"
  }
}