{
  "chief_complaint": "cough",
  "vitals": {
    "bp": "127/72",
    "hr": 82,
    "temp_f": 98.6,
    "spo2": 97
  },
  "medications": [
    {
      "name": "lisinopril",
      "dose": "10mg",
      "frequency": "daily",
      "route": "oral"
    }
  ],
  "diagnoses": [
    {
      "description": "viral URI",
      "icd10": "J06.9"
    }
  ],
  "plan": [
    "rest",
    "hydration",
    "return precautions"
  ],
  "follow_up": {
    "interval_days": 18,
    "reason": "symptom review"
  }
}