{
  "chief_complaint": "dizziness",
  "vitals": {
    "bp": "114/74",
    "hr": 69,
    "temp_f": 98.8,
    "spo2": 99
  },
  "medications": [
    {
      "name": "ibuprofen",
      "dose": "200mg",
      "frequency": "BID",
      "route": "oral"
    }
  ],
  "diagnoses": [
    {
      "description": "low back strain",
      "icd10": "S39.012A"
    }
  ],
  "plan": [
    "rest",
    "hydration",
    "return precautions"
  ],
  "follow_up": {
    "interval_days": 5,
    "reason": "symptom review"
  }
}