{
  "chief_complaint": "dizziness",
  "vitals": {
    "bp": "116/71",
    "hr": 86,
    "temp_f": 98.8,
    "spo2": 96
  },
  "medications": [
    {
      "name": "metformin",
      "dose": "500mg",
      "frequency": "BID",
      "route": "oral"
    }
  ],
  "diagnoses": [
    {
      "description": "migraine",
      "icd10": "G43.909"
    }
  ],
  "plan": [
    "rest",
    "hydration",
    "return precautions"
  ],
  "follow_up": {
    "interval_days": 17,
    "reason": "symptom review"
  }
}