{
  "chief_complaint": "back pain",
  "vitals": {
    "bp": "110/80",
    "hr": 80,
    "temp_f": 99.0,
    "spo2": 95
  },
  "medications": [
    {
      "name": "ibuprofen",
      "dose": "200mg",
      "frequency": "BID",
      "route": "oral"
    }
  ],
  "diagnoses": [
    {
      "description": "hypertension",
      "icd10": "I10"
    }
  ],
  "plan": [
    "rest",
    "hydration",
    "return precautions"
  ],
  "follow_up": {
    "interval_days": 11,
    "reason": "symptom review"
  }
}