{
  "chief_complaint": "fatigue",
  "vitals": {
    "bp": "120/70",
    "hr": 70,
    "temp_f": 98.4,
    "spo2": 95
  },
  "medications": [
    {
      "name": "metformin",
      "dose": "500mg",
      "frequency": "BID",
      "route": "oral"
    }
  ],
  "diagnoses": [
    {
      "description": "hypertension",
      "icd10": "I10"
    }
  ],
  "plan": [
    "rest",
    "hydration",
    "return precautions"
  ],
  "follow_up": {
    "interval_days": 1,
    "reason": "symptom review"
  }
}