{
  "chief_complaint": "nausea",
  "vitals": {
    "bp": "117/82",
    "hr": 67,
    "temp_f": 99.2,
    "spo2": 97
  },
  "medications": [
    {
      "name": "albuterol",
      "dose": "2 puffs",
      "frequency": "q4h prn",
      "route": "inhaled"
    }
  ],
  "diagnoses": [
    {
      "description": "viral URI",
      "icd10": "J06.9"
    }
  ],
  "plan": [
    "rest",
    "hydration",
    "return precautions"
  ],
  "follow_up": {
    "interval_days": 28,
    "reason": "symptom review"
  }
}